[debug] [2025-11-06T07:36:32.699Z] : 
[debug] [2025-11-06T07:36:32.704Z] : ----------------------------------------------------------------------
[debug] [2025-11-06T07:36:32.704Z] : Command:      /Users/kedar/.nvm/versions/node/v20.18.1/bin/node /Users/kedar/.nvm/versions/node/v20.18.1/bin/catalyst serve
[debug] [2025-11-06T07:36:32.704Z] : CLI Version:  1.21.0
[debug] [2025-11-06T07:36:32.704Z] : Platform:     darwin
[debug] [2025-11-06T07:36:32.704Z] : Node Version: v20.18.1
[debug] [2025-11-06T07:36:32.704Z] : Time:         Thu Nov 06 2025 13:06:32 GMT+0530 (India Standard Time)
[debug] [2025-11-06T07:36:32.705Z] : ----------------------------------------------------------------------
[debug] [2025-11-06T07:36:32.705Z] : 
[debug] [2025-11-06T07:36:32.884Z] : > authorizing via signed-in user option
[debug] [2025-11-06T07:36:32.884Z] : > command requires scopes: ["ZohoCatalyst.projects.ALL","ZohoCatalyst.apigateway.apis.READ","ZohoCatalyst.apigateway.READ","ZohoCatalyst.segments.ALL","ZohoCatalyst.cache.READ","ZohoCatalyst.cache.CREATE","ZohoCatalyst.cache.DELETE","ZohoCatalyst.projects.ALL","ZohoCatalyst.cron.ALL","ZohoCatalyst.zcql.CREATE","ZohoCatalyst.projects.users.READ","ZohoCatalyst.projects.users.CREATE","ZohoCatalyst.projects.users.DELETE","ZohoCatalyst.projects.users.UPDATE","ZohoCatalyst.authentication.CREATE","ZohoCatalyst.email.CREATE","ZohoCatalyst.tables.ALL","ZohoCatalyst.tables.rows.ALL","ZohoCatalyst.tables.columns.ALL","ZohoCatalyst.tables.bulk.CREATE","ZohoCatalyst.tables.bulk.READ","ZohoCatalyst.folders.ALL","ZohoCatalyst.files.CREATE","ZohoCatalyst.files.READ","ZohoCatalyst.files.DELETE","ZohoCatalyst.functions.ALL","ZohoCatalyst.functions.EXECUTE","ZohoCatalyst.eventlistners.ALL","ZohoCatalyst.eventlisteners.produce","ZohoCatalyst.security.rules.Read","ZohoCatalyst.security.rules.Update","ZohoCatalyst.notifications.mobile","ZohoCatalyst.notifications.web","ZohoCatalyst.search.READ","ZohoCatalyst.mlkit.READ","QuickML.deployment.READ","ZohoCatalyst.pdfshot.execute","ZohoCatalyst.circuits.execution.DELETE","ZohoCatalyst.circuits.execution.READ","ZohoCatalyst.circuits.execute","ZohoCatalyst.appsail.Read","ZohoCatalyst.jobpool.READ","ZohoCatalyst.job.ALL","ZohoCatalyst.nosql.READ","ZohoCatalyst.nosql.rows.ALL"]
[debug] [2025-11-06T07:36:32.889Z] : >>>> HTTP REQUEST : GET https://api.catalyst.zoho.in/baas/v1/project/17682000000454057 

[debug] [2025-11-06T07:36:33.011Z] : <<<< HTTP RESPONSE : 200
Response Headers: {"server":"ZGS","date":"Thu, 06 Nov 2025 07:36:33 GMT","content-type":"application/vnd.catalyst.v2+json","transfer-encoding":"chunked","connection":"keep-alive","x-content-type-options":"nosniff","cache-control":"private,no-cache,no-store,max-age=0,must-revalidate","pragma":"no-cache","expires":"Thu, 01 Jan 1970 00:00:00 GMT","x-frame-options":"DENY","strict-transport-security":"max-age=64072000; includeSubDomains; preload"}

[debug] [2025-11-06T07:36:33.012Z] : >>>> HTTP REQUEST : GET https://api.catalyst.zoho.in/baas/v1/project/17682000000454057/environment 

[debug] [2025-11-06T07:36:33.039Z] : <<<< HTTP RESPONSE : 200
Response Headers: {"server":"ZGS","date":"Thu, 06 Nov 2025 07:36:33 GMT","content-type":"application/vnd.catalyst.v2+json","transfer-encoding":"chunked","connection":"keep-alive","x-content-type-options":"nosniff","cache-control":"private,no-cache,no-store,max-age=0,must-revalidate","pragma":"no-cache","expires":"Thu, 01 Jan 1970 00:00:00 GMT","x-frame-options":"DENY","strict-transport-security":"max-age=64072000; includeSubDomains; preload"}

[debug] [2025-11-06T07:36:33.128Z] : >>>> HTTP REQUEST : GET https://api.catalyst.zoho.in/baas/v1/project/17682000000454057/function 
Query params: {"type":"basicio,event,cron,applogic,integration,browser_logic,job"}

[debug] [2025-11-06T07:36:33.167Z] : http port : '5000' is not available. Hence port '5001' will be used instead.
[debug] [2025-11-06T07:36:33.171Z] : <<<< HTTP RESPONSE : 200
Response Headers: {"server":"ZGS","date":"Thu, 06 Nov 2025 07:36:33 GMT","content-type":"application/vnd.catalyst.v2+json","transfer-encoding":"chunked","connection":"keep-alive","x-content-type-options":"nosniff","cache-control":"private,no-cache,no-store,max-age=0,must-revalidate","pragma":"no-cache","expires":"Thu, 01 Jan 1970 00:00:00 GMT","x-frame-options":"DENY","strict-transport-security":"max-age=64072000; includeSubDomains; preload"}

[debug] [2025-11-06T07:36:33.172Z] : unknown eol undefined hence skipping check
[info] [2025-11-06T07:36:34.087Z] : [react-plugin]: Starting the development server...

[info] [2025-11-06T07:36:34.088Z] : 
[info] [2025-11-06T07:36:34.088Z] : ℹ Client[react-app]: Plugin : "zcatalyst-cli-plugin-react" is used for client serve
[info] [2025-11-06T07:36:34.088Z] : 
[info] [2025-11-06T07:36:34.455Z] : 
[info] [2025-11-06T07:36:34.455Z] :  >>>>>>>>>>>>> AdvancedIO <<<<<<<<<<<< 
[info] [2025-11-06T07:36:34.455Z] : ℹ ci_cd_function: http://localhost:3000/server/ci_cd_function/
[info] [2025-11-06T07:36:34.455Z] : 
[info] [2025-11-06T07:36:34.455Z] : 
[info] [2025-11-06T07:36:34.455Z] :  >>>>>>>>>>>>> Web Client <<<<<<<<<<<<
[info] [2025-11-06T07:36:34.455Z] : ℹ client[react-app]: http://localhost:3000/app/
[info] [2025-11-06T07:36:34.455Z] : 
[info] [2025-11-06T07:36:37.239Z] : [react-plugin]: Compiled successfully!
[info] [2025-11-06T07:36:37.239Z] : [react-plugin]: 
[info] [2025-11-06T07:36:37.239Z] : [react-plugin]: You can now view react-app in the browser.
[info] [2025-11-06T07:36:37.239Z] : [react-plugin]: 
[info] [2025-11-06T07:36:37.239Z] : [react-plugin]:   Local:            http://localhost:3000/app/
[info] [2025-11-06T07:36:37.239Z] : [react-plugin]:   On Your Network:  http://192.168.20.42:3000/app/
[info] [2025-11-06T07:36:37.239Z] : [react-plugin]: 
[info] [2025-11-06T07:36:37.239Z] : [react-plugin]: Note that the development build is not optimized.
[info] [2025-11-06T07:36:37.239Z] : [react-plugin]: To create a production build, use npm run build.
[info] [2025-11-06T07:36:37.239Z] : [react-plugin]: 
[info] [2025-11-06T07:37:47.931Z] : 
change of package-lock.json in ci_cd_function detected. Preparing your function, please wait...
[info] [2025-11-06T07:37:48.228Z] : ℹ AdvancedIO[ci_cd_function]: ready!
[info] [2025-11-06T07:37:48.228Z] : ℹ AdvancedIO[ci_cd_function]: http://localhost:3000/server/ci_cd_function/
[info] [2025-11-06T07:37:53.882Z] : 
change of index.js in ci_cd_function detected. Preparing your function, please wait...
[info] [2025-11-06T07:37:54.239Z] : ℹ AdvancedIO[ci_cd_function]: ready!
[info] [2025-11-06T07:37:54.239Z] : ℹ AdvancedIO[ci_cd_function]: http://localhost:3000/server/ci_cd_function/
[info] [2025-11-06T07:38:04.386Z] : 
change of index.js in ci_cd_function detected. Preparing your function, please wait...
[info] [2025-11-06T07:38:04.773Z] : ℹ AdvancedIO[ci_cd_function]: ready!
[info] [2025-11-06T07:38:04.773Z] : ℹ AdvancedIO[ci_cd_function]: http://localhost:3000/server/ci_cd_function/
[info] [2025-11-06T07:38:05.774Z] : 
change of index.js in ci_cd_function detected. Preparing your function, please wait...
[info] [2025-11-06T07:38:06.071Z] : ℹ AdvancedIO[ci_cd_function]: ready!
[info] [2025-11-06T07:38:06.071Z] : ℹ AdvancedIO[ci_cd_function]: http://localhost:3000/server/ci_cd_function/
[info] [2025-11-06T07:38:08.626Z] : 
change of index.js in ci_cd_function detected. Preparing your function, please wait...
[info] [2025-11-06T07:38:08.943Z] : ℹ AdvancedIO[ci_cd_function]: ready!
[info] [2025-11-06T07:38:08.943Z] : ℹ AdvancedIO[ci_cd_function]: http://localhost:3000/server/ci_cd_function/
[info] [2025-11-06T07:38:10.944Z] : 
change of index.js in ci_cd_function detected. Preparing your function, please wait...
[info] [2025-11-06T07:38:11.266Z] : ℹ AdvancedIO[ci_cd_function]: ready!
[info] [2025-11-06T07:38:11.266Z] : ℹ AdvancedIO[ci_cd_function]: http://localhost:3000/server/ci_cd_function/
[info] [2025-11-06T07:38:27.127Z] : 
change of index.js in ci_cd_function detected. Preparing your function, please wait...
[info] [2025-11-06T07:38:27.516Z] : ℹ AdvancedIO[ci_cd_function]: ready!
[info] [2025-11-06T07:38:27.517Z] : ℹ AdvancedIO[ci_cd_function]: http://localhost:3000/server/ci_cd_function/
[info] [2025-11-06T07:38:29.139Z] : 
change of index.js in ci_cd_function detected. Preparing your function, please wait...
[info] [2025-11-06T07:38:29.450Z] : ℹ AdvancedIO[ci_cd_function]: ready!
[info] [2025-11-06T07:38:29.450Z] : ℹ AdvancedIO[ci_cd_function]: http://localhost:3000/server/ci_cd_function/
[info] [2025-11-06T07:38:36.001Z] : 
change of index.js in ci_cd_function detected. Preparing your function, please wait...
[info] [2025-11-06T07:38:36.304Z] : ℹ AdvancedIO[ci_cd_function]: ready!
[info] [2025-11-06T07:38:36.304Z] : ℹ AdvancedIO[ci_cd_function]: http://localhost:3000/server/ci_cd_function/
[info] [2025-11-06T07:38:43.673Z] : 
change of index.js in ci_cd_function detected. Preparing your function, please wait...
[info] [2025-11-06T07:38:43.988Z] : ℹ AdvancedIO[ci_cd_function]: ready!
[info] [2025-11-06T07:38:43.989Z] : ℹ AdvancedIO[ci_cd_function]: http://localhost:3000/server/ci_cd_function/
[info] [2025-11-06T07:38:46.095Z] : 
change of index.js in ci_cd_function detected. Preparing your function, please wait...
[info] [2025-11-06T07:38:46.416Z] : ℹ AdvancedIO[ci_cd_function]: ready!
[info] [2025-11-06T07:38:46.416Z] : ℹ AdvancedIO[ci_cd_function]: http://localhost:3000/server/ci_cd_function/
[info] [2025-11-06T07:38:48.013Z] : 
change of index.js in ci_cd_function detected. Preparing your function, please wait...
[info] [2025-11-06T07:38:48.336Z] : ℹ AdvancedIO[ci_cd_function]: ready!
[info] [2025-11-06T07:38:48.336Z] : ℹ AdvancedIO[ci_cd_function]: http://localhost:3000/server/ci_cd_function/
[info] [2025-11-06T07:38:55.193Z] : 
change of index.js in ci_cd_function detected. Preparing your function, please wait...
[info] [2025-11-06T07:38:55.500Z] : ℹ AdvancedIO[ci_cd_function]: ready!
[info] [2025-11-06T07:38:55.500Z] : ℹ AdvancedIO[ci_cd_function]: http://localhost:3000/server/ci_cd_function/
[info] [2025-11-06T07:38:58.521Z] : 
change of index.js in ci_cd_function detected. Preparing your function, please wait...
[info] [2025-11-06T07:38:58.848Z] : ℹ AdvancedIO[ci_cd_function]: ready!
[info] [2025-11-06T07:38:58.848Z] : ℹ AdvancedIO[ci_cd_function]: http://localhost:3000/server/ci_cd_function/
[info] [2025-11-06T07:39:04.374Z] : 
change of index.js in ci_cd_function detected. Preparing your function, please wait...
[info] [2025-11-06T07:39:04.694Z] : ℹ AdvancedIO[ci_cd_function]: ready!
[info] [2025-11-06T07:39:04.694Z] : ℹ AdvancedIO[ci_cd_function]: http://localhost:3000/server/ci_cd_function/
[info] [2025-11-06T07:39:10.759Z] : 
change of index.js in ci_cd_function detected. Preparing your function, please wait...
[info] [2025-11-06T07:39:11.093Z] : ℹ AdvancedIO[ci_cd_function]: ready!
[info] [2025-11-06T07:39:11.094Z] : ℹ AdvancedIO[ci_cd_function]: http://localhost:3000/server/ci_cd_function/
[info] [2025-11-06T07:39:17.718Z] : 
change of index.js in ci_cd_function detected. Preparing your function, please wait...
[info] [2025-11-06T07:39:18.048Z] : ℹ AdvancedIO[ci_cd_function]: ready!
[info] [2025-11-06T07:39:18.048Z] : ℹ AdvancedIO[ci_cd_function]: http://localhost:3000/server/ci_cd_function/
[info] [2025-11-06T07:40:00.341Z] : 
change of index.js in ci_cd_function detected. Preparing your function, please wait...
[info] [2025-11-06T07:40:00.737Z] : ℹ AdvancedIO[ci_cd_function]: ready!
[info] [2025-11-06T07:40:00.737Z] : ℹ AdvancedIO[ci_cd_function]: http://localhost:3000/server/ci_cd_function/
[info] [2025-11-06T07:40:21.997Z] : [react-plugin]: Compiling...
[info] [2025-11-06T07:40:22.227Z] : [react-plugin]: Compiled with warnings.

[info] [2025-11-06T07:40:22.227Z] : [react-plugin]: [eslint] 
src/App.js
  Line 1:8:  'logo' is defined but never used  no-unused-vars
[info] [2025-11-06T07:40:22.227Z] : [react-plugin]: 
Search for the keywords to learn more about each warning.
[info] [2025-11-06T07:40:22.227Z] : [react-plugin]: To ignore, add // eslint-disable-next-line to the line before.

[info] [2025-11-06T07:40:28.583Z] : [react-plugin]: Compiling...
[info] [2025-11-06T07:40:28.676Z] : [react-plugin]: Compiled with warnings.

[info] [2025-11-06T07:40:28.676Z] : [react-plugin]: [eslint] 
src/App.js
  Line 1:8:  'logo' is defined but never used  no-unused-vars
[info] [2025-11-06T07:40:28.676Z] : [react-plugin]: 
Search for the keywords to learn more about each warning.
[info] [2025-11-06T07:40:28.676Z] : [react-plugin]: To ignore, add // eslint-disable-next-line to the line before.

[info] [2025-11-06T07:40:34.705Z] : [react-plugin]: Compiling...
[info] [2025-11-06T07:40:34.787Z] : [react-plugin]: Compiled with warnings.

[info] [2025-11-06T07:40:34.787Z] : [react-plugin]: [eslint] 
src/App.js
  Line 1:8:  'logo' is defined but never used  no-unused-vars
[info] [2025-11-06T07:40:34.787Z] : [react-plugin]: 
Search for the keywords to learn more about each warning.
[info] [2025-11-06T07:40:34.787Z] : [react-plugin]: To ignore, add // eslint-disable-next-line to the line before.

[info] [2025-11-06T07:40:51.543Z] : Shutting down server
[info] [2025-11-06T07:40:51.604Z] : 
[info] [2025-11-06T07:40:51.605Z] : ✔ Shutdown complete
[debug] [2025-11-06T07:40:51.605Z] : NO ERRORS REGISTERED
[debug] [2025-11-06T07:40:51.605Z] : EXEC ENDED with event: serve, message: success
[debug] [2025-11-06T07:40:51.605Z] : TOTAL DURATION OF COMMAND EXEC : 258725
[debug] [2025-11-06T07:40:51.610Z] : >>>> HTTP REQUEST : POST https://api.catalyst.zoho.in/baas/v1/cli/logs 
<request body omitted>

[debug] [2025-11-06T07:40:51.743Z] : <<<< HTTP RESPONSE : 200
Response Headers: {"server":"ZGS","date":"Thu, 06 Nov 2025 07:40:51 GMT","content-length":"0","connection":"keep-alive","x-content-type-options":"nosniff","cache-control":"private,no-cache,no-store,max-age=0,must-revalidate","pragma":"no-cache","expires":"Thu, 01 Jan 1970 00:00:00 GMT","x-frame-options":"DENY","strict-transport-security":"max-age=64072000; includeSubDomains; preload"}

